DDL
====
>> Create

CREATE TABLE primark
(EMPNO NUMBER(4) NOT NULL,
ENAME VARCHAR2(10),
JOB VARCHAR2(9),
MGR NUMBER(4),
HIREDATE DATE,
SAL NUMBER(7, 2),
COMM NUMBER(7, 2),
DEPTNO NUMBER(2));

>> Alter

> MODIFY	> ADD	> RENAME	> DROP
1) MODIFY : To change datatype and the size of datatype of a column.

SQL> desc emp;
 Name                                                                                Null?    Type
 ----------------------------------------------------------------------------------- -------- --------------------------------------------------------
 EMPNO                                                                               NOT NULL NUMBER(4)
 ENAME                                                                                        VARCHAR2(10)
 JOB                                                                                          VARCHAR2(9)
 MGR                                                                                          NUMBER(4)
 HIREDATE                                                                                     DATE
 SAL                                                                                          NUMBER(7,2)
 COMM                                                                                         NUMBER(7,2)
 DEPTNO                                                                                       NUMBER(2)

SQL> ALTER TABLE EMP MODIFY DEPTNO NUMBER(3);

 DEPTNO                                                                                       NUMBER(3)

2) ADD : To add new column to an existing table.

SQL> alter table emp add enick varchar2(10);

ENICK                                                                                        VARCHAR2(10)

3) RENAME : To change column name in a table.

SQL> alter table emp rename column enick to ennick;

 ENNICK                                                                                       VARCHAR2(10)
 
4) DROP	

SQL> alter table emp drop column ennick;

SQL> desc emp;
 Name                                                                                Null?    Type
 ----------------------------------------------------------------------------------- -------- --------------------------------------------------------
 EMPNO                                                                               NOT NULL NUMBER(4)
 ENAME                                                                                        VARCHAR2(10)
 JOB                                                                                          VARCHAR2(9)
 MGR                                                                                          NUMBER(4)
 HIREDATE                                                                                     DATE
 SAL                                                                                          NUMBER(7,2)
 COMM                                                                                         NUMBER(7,2)
 DEPTNO                                                                                       NUMBER(3)
 
3) Rename : To change a table name.

Before : EMP

SQL> RENAME EMP TO EMPLOYEE; 

AFTER : EMPLOYEE

4) TRUNCATE : To delete all rows from a table permanently ( but not columns)
              TRUNCATE command is not supporting " where " condition
			  If we use TRUNCATE command we can not take back the data .
SQL> TRUNCATE table emp;
	  
5) drop : To delete entire table.
          But data goes to recyclebin.

SQL> drop table primark;  ---- it goes to recyclebin
     Table dropped.
	 
New features:
-------------
> recyclebin : Used to store informationabout dropped tables.

> Flashback : Used to restore a table into db.
 -After drop we can get back table by using flashback command

SQL> flashback table primark to before drop;

> PURGE : Used to delete a table permanently.

 -Case 1: delete a specific table from recyclebin.
  EX: Purge table primark;
 
 -Case 2: delete all rows from recyclebin.
  EX: purge recyclebin;
  
 -Case 3: delete a table from DB permanently.
  EX: drop table primark purge;
  
DML: (Data manipulation lang)
======

> Insert	> UPDATE	> delete

>> Insert: To insert new row data into a table
 EX: 1) insert into primark values(&psno,'&pname'); -- Multiple rows
     2) insert into primark values(22, 'rajan'); -- Single row
	 
>> UPDATE : To update all rows or specific row in a table by using "where" condition.
 
 EX: Before 
 
 SQL> select * from hyd;

       EID ENAME             SAL
---------- ---------- ----------
      1021 smith            8500
      1022 allen            6500
      1023 ward            25000
	  
SQL> update hyd set sal=2500 where ename='ward';  
	  
	 After 
	 
 SQL> select * from  hyd;
	 
  EID ENAME             SAL
---------- ---------- ----------
      1021 smith            8500
      1022 allen            6500
      1023 ward             2500	

>> DELETE : To delete all rows or a specific row  from a table by using "where" condition.

EX : Before

SQL> select * from hyd;

       EID ENAME             SAL
---------- ---------- ----------
      1021 smith            8500
      1022 allen            6500
      1023 ward             2500
      1010 alex             6700 
	  
SQL> delete from hyd where eid=1010;

    After

SQL> select * from hyd;

       EID ENAME             SAL
---------- ---------- ----------
      1021 smith            8500
      1022 allen            6500
      1023 ward             2500	
	  
    DELETE								TRUNCATE

1) DML								1) DDL
2) Delete specific row				2) Delete entire row
3) Support where condition			3) Not support where condition
4) TEMPORARY data deletion			4) Permanently data deletion
5) restore data by using "rollback" 5) Cannot restore
6) execution is slow                6) Fast execution

DQL/DRL (Data query lang/data retrieval lang)
========

>> SELECT : To retrieving all rows or a specific row from a table.

EX: sql>select * from hyd;

     EID ENAME             SAL
---------- ---------- ----------
      1021 smith            8500
      1022 allen            6500
      1023 ward             2500

sql>select ename from hyd;

ENAME
----------
smith
allen
ward

Distinct: repeated data will absent.

EX:

SQL> select * from hyd;

       EID ENAME             SAL
---------- ---------- ----------
      1021 smith            8500
      1022 allen            6500
      1023 ward             2500
      1010 smith            8500
	  
SQL> select distinct ename,sal from hyd;

 ENAME             SAL
---------- ----------
smith            8500
allen            6500
ward             2500

TCL (TRANSITIONAL control lang)
====

> COMMIT 	> ROLLBACK	 > SAVEPOINT

>> COMMIT : Save permanently in DB.

SQL> commit;

Commit complete.

EX:
SQL> CREATE TABLE BRANCH(BCODE INT,BNAME VARCHAR2(10),BLOC
VARCHAR2(10));
TESTING:
SQL> INSERT INTO BRANCH VALUES(1021,'SBI','HYD');
SQL> COMMIT;
SQL> UPDATE BRANCH SET BLOC='PUNE' WHERE BCODE=1021;
SQL> COMMIT;
SQL> DELETE FROM BRANCH WHERE BCODE=1021;
SQL> COMMIT;
(OR)
SQL> INSERT INTO BRANCH VALUES(1021,'SBI','HYD');
SQL> UPDATE BRANCH SET BLOC='PUNE' WHERE BCODE=1021;
SQL> DELETE FROM BRANCH WHERE BCODE=1021;
SQL> COMMIT;


>> ROLLBACK : What we can save it will cancel.
 
 SQL> rollback;

Rollback complete.

SQL> INSERT INTO DEF (SID,SNAME) VALUES (15,'RAMU');

1 row created.

SQL> SELECT * FROM DEF;

       SID SNAME      BRANCH
---------- ---------- ----------
        12 RAJ        ECE
        13 RAJ        EEE
        14 RAJ
        15 RAMU       ECE

SQL> DELETE FROM DEF WHERE SID=14;

1 row deleted.

SQL> ROLLBACK;

Rollback complete.

SQL> SELECT * FROM DEF;

no rows selected

SQL> INSERT INTO DEF (SID,SNAME) VALUES (15,'RAMU');

1 row created.

SQL> INSERT INTO DEF (SID,SNAME,BRANCH)VALUES(15,'RAMU','EEE');
INSERT INTO DEF (SID,SNAME,BRANCH)VALUES(15,'RAMU','EEE')
*
ERROR at line 1:
ORA-00001: unique constraint (SYSTEM.SYS_C007672) violated


SQL> INSERT INTO DEF (SID,SNAME,BRANCH)VALUES(115,'RAMU','EEE');

1 row created.

SQL> SELECT * FROM DEF;

       SID SNAME      BRANCH
---------- ---------- ----------
        15 RAMU       ECE
       115 RAMU       EEE

SQL> COMMIT;

Commit complete.

SQL> DELETE FROM DEF WHERE SID=115;

1 row deleted.

SQL> ROLLBACK;

Rollback complete.

SQL> SELECT * FROM DEF;

       SID SNAME      BRANCH
---------- ---------- ----------
        15 RAMU       ECE
       115 RAMU       EEE

>> SAVEPOINT : Save permanently what we can want.

SQL> savepoint hyd;

Savepoint created.

HOW TO ROLLBACK A SAVEPOINT:
=============================
SYNTAX:
========
ROLLBACK TO <SAVEPOINT NAME>;
EX:
SQL> DELETE FROM BRANCH WHERE BCODE=1021;
SQL> DELETE FROM BRANCH WHERE BCODE=1025;
SQL> SAVEPOINT P1;
Savepoint created.
SQL> DELETE FROM BRANCH WHERE BCODE=1023;
CASE-1:
=======
SQL> ROLLBACK TO P1;
CASE-2:
=======
SQL> COMMIT / ROLLBACK;
EX:
SQL> DELETE FROM BRANCH WHERE BCODE=1021;
SQL> SAVEPOINT P1;
Savepoint created.
SQL> DELETE FROM BRANCH WHERE BCODE IN(1023,1025);


DCL (Data control lang)
=====

> GRANT 	> REVOKE

>> Grant : Used to grant permissions to USER.

SYN: Grant <privilege name> TO user;

>> REVOKE : Used to cancel permission of user.

SYN : Revoke <privilege name> from <user>.


 